{
  "agent_outputs": [
    {
      "agent_name": "bull",
      "claim_strength": 45,
      "conclusion": "上方向Evidenceは限定的で、現時点では中期仮説を強く補強する材料は乏しい。価格・出来高の一次データは確認できるが、事業面の改善や新規ドライバーを直接示すEvidenceは見当たらない。",
      "confidence": "medium",
      "evidence_ids": [
        "E20250328-004",
        "E20250328-051",
        "E20250328-061",
        "E20250328-301"
      ],
      "key_points": [
        "E20250328-051では2025-03-28の出来高が5日平均比で1.2552倍と、短期需給の改善を示す可能性がある。",
        "E20250328-061では比較対象に対する相対比較が行われているが、平均との差は0.0ptで、個別の上振れを示す内容ではない。",
        "E20250328-301でJPXの公式IRページの存在は確認できるが、個別の材料や業績更新を示す内容ではない。",
        "価格系Evidenceは同日の値動きと出来高の確認にとどまり、事業成長や政策追い風を直接裏づけるものではない。"
      ],
      "limitations": [
        "価格・出来高データは短期需給の確認には使えるが、中期仮説の根拠としては直接性が弱い。",
        "重複する日次価格Evidenceが多く、新しい材料の増分が小さい。",
        "公式IRやニュースは存在確認レベルで、投資仮説を更新する中身の精査はできていない。"
      ],
      "run_id": "PIPE-20250328-TARGET-SAMPLE-8697-RESEARCH-BULL",
      "schema_version": "agent_output_v1",
      "stance": "中期仮説を補強する事実を整理する"
    },
    {
      "agent_name": "bear",
      "claim_strength": 58,
      "conclusion": "下方向Evidenceは主に2025-03-28の価格下落と出来高増加に限られ、現時点では中期仮説を大きく崩すほどの事業悪化材料は見当たらない。ただし、短期的には地合い悪化や需給悪化による押し下げリスクがあるため、価格面の弱さは軽視できない。",
      "confidence": "medium",
      "evidence_ids": [
        "E20250328-001",
        "E20250328-002",
        "E20250328-003",
        "E20250328-005",
        "E20250328-051",
        "E20250328-061",
        "E20250328-101"
      ],
      "key_points": [
        "E20250328-051では2025-03-28の終値が前日比-4.647%で、5日平均比出来高も1.2552倍となっており、短期的な売り圧力や需給の悪化を示唆する。",
        "E20250328-005では同日の終値が1580.0まで下落しており、当日の安値圏で引けた点は弱含みの値動きとして解釈できる。",
        "E20250328-001、E20250328-002、E20250328-003はいずれも同日の価格・出来高データで、単独では中期仮説を大きく弱めないが、下方向の短期モメンタム確認には使える。",
        "E20250328-061では比較対象に対する相対差が0.0ptで、個別に大きく売られたというより地合い要因の影響を受けた可能性がある。",
        "E20250328-101では当日のEDINETで該当開示が見つからず、少なくともこの時点で明確な悪材料開示は確認できない。"
      ],
      "limitations": [
        "価格下落が一時的な需給要因か、業績や制度変更に起因する構造的な悪化かは未判定。",
        "ニュースEvidenceは存在確認中心で、本文精査がないため下方向材料としては弱い。",
        "公式開示の空白は悪材料の不存在を意味しないため、未確認情報の影響は残る。"
      ],
      "run_id": "PIPE-20250328-TARGET-SAMPLE-8697-RESEARCH-BEAR",
      "schema_version": "agent_output_v1",
      "stance": "中期仮説を弱める事実や短期リスクを整理する"
    },
    {
      "agent_name": "contradiction",
      "claim_strength": 12,
      "conclusion": "既存仮説を明確に崩すEvidenceは見当たらない。2025-03-28の価格下落と出来高増加は短期的な弱さを示すが、需要不在・競争優位の崩壊・構造的な受注失速・価格維持失敗を直接示す反証にはならない。",
      "confidence": "low",
      "evidence_ids": [
        "E20250328-051",
        "E20250328-061",
        "E20250328-101"
      ],
      "key_points": [
        "E20250328-051は前日比下落と出来高増加を示すが、これは短期需給の弱さにとどまり、仮説前提そのものの崩壊は示していない。",
        "E20250328-061では相対比較差が0.0ptで、個別銘柄だけが明確に崩れた証拠にはならない。",
        "E20250328-101で該当するEDINET開示は見つからず、少なくともこの時点で反証となる公的開示は確認できない。",
        "ニュース証拠は存在確認中心で本文精査がなく、仮説を壊す直接材料としては弱い。"
      ],
      "limitations": [
        "価格データだけでは中期仮説の反証力が弱い。",
        "開示なしは悪材料不存在の証明ではない。",
        "未確認のニュース本文やIR本文を確認しない限り、反証の強度は上がらない。"
      ],
      "run_id": "PIPE-20250328-TARGET-SAMPLE-8697-RESEARCH-CONTRA",
      "schema_version": "agent_output_v1",
      "stance": "仮説に反する材料や矛盾を整理する"
    },
    {
      "agent_name": "pricing",
      "claim_strength": 100,
      "conclusion": "2025-03-28のJPXは、前日比下落と出来高増加が見られる一方で、同日の相対比較は0.0ptで個別の極端な強弱は確認できない。価格反応は短期的な弱さを示すが、材料が完全に織り込まれたと断定できるほどの追加材料はなく、過熱判定にも不足がある。",
      "confidence": "medium",
      "evidence_ids": [
        "E20250328-001",
        "E20250328-002",
        "E20250328-003",
        "E20250328-004",
        "E20250328-005",
        "E20250328-051",
        "E20250328-061",
        "E20250328-101",
        "E20250328-301"
      ],
      "key_points": [
        "E20250328-051では2025-03-28の終値が前日比-4.647%で、5日平均比出来高も1.2552倍となっており、短期的な売り圧力と需給悪化の可能性がある。",
        "E20250328-005でも終値は1580.0で、当日レンジ内の弱い引けが確認できる。",
        "E20250328-061の相対比較では平均との差が0.0ptで、銘柄固有の強い反応というより地合い影響を含む動きとみられる。",
        "E20250328-101ではEDINETで該当開示は見つからず、価格変動を直接説明する新規公的材料は確認できない。",
        "E20250328-301で公式IRページは確認できるが、個別の業績更新や資本政策などの強い織り込み材料は読めない。"
      ],
      "limitations": [
        "前日比、移動平均、信用残、空売り、セクター比較が不足しているため、織り込み度を強く断定できない。",
        "価格下落だけでは、材料の全織り込みや過熱解消とは言えない。",
        "ニュースは存在確認中心で本文精査がなく、価格反応との因果は弱い。"
      ],
      "run_id": "PIPE-20250328-TARGET-SAMPLE-8697-RESEARCH-PRICING",
      "schema_version": "agent_output_v1",
      "stance": "材料が価格に織り込まれている可能性を整理する"
    }
  ],
  "report_date": "2025-03-28",
  "schema_version": "agent_outputs_bundle_v1",
  "target_id": "TARGET-SAMPLE-8697"
}
